{
  "schema_version": "tokito.symbol-spec.v1",
  "manufacturer": "Texas Instruments",
  "mpn": "TPS5430DDAR",
  "package": "SO-PowerPAD-8",
  "reference_prefix": "U",
  "pins": [
    {
      "number": "1",
      "name": "BOOT",
      "electrical": "output",
      "style": "line",
      "group": "switching",
      "unit": 1,
      "hidden": false,
      "confidence": 0.99,
      "evidence_region_ids": ["r_pinout_01", "r_pin_table_01"]
    },
    {
      "number": "2",
      "name": "NC",
      "electrical": "no_connect",
      "style": "line",
      "group": "no_connect",
      "unit": 1,
      "hidden": false,
      "confidence": 0.99,
      "evidence_region_ids": ["r_pinout_01", "r_pin_table_01"]
    },
    {
      "number": "3",
      "name": "NC",
      "electrical": "no_connect",
      "style": "line",
      "group": "no_connect",
      "unit": 1,
      "hidden": false,
      "confidence": 0.99,
      "evidence_region_ids": ["r_pinout_01", "r_pin_table_01"]
    },
    {
      "number": "4",
      "name": "VSENSE",
      "electrical": "input",
      "style": "line",
      "group": "feedback",
      "unit": 1,
      "hidden": false,
      "confidence": 0.99,
      "evidence_region_ids": ["r_pinout_01", "r_pin_table_01"]
    },
    {
      "number": "5",
      "name": "ENA",
      "electrical": "input",
      "style": "line",
      "group": "control",
      "unit": 1,
      "hidden": false,
      "confidence": 0.99,
      "evidence_region_ids": ["r_pinout_01", "r_pin_table_01"]
    },
    {
      "number": "6",
      "name": "GND",
      "electrical": "power_in",
      "style": "line",
      "group": "power",
      "unit": 1,
      "hidden": false,
      "confidence": 0.99,
      "evidence_region_ids": ["r_pinout_01", "r_pin_table_01"]
    },
    {
      "number": "7",
      "name": "VIN",
      "electrical": "power_in",
      "style": "line",
      "group": "power",
      "unit": 1,
      "hidden": false,
      "confidence": 0.99,
      "evidence_region_ids": ["r_pinout_01", "r_pin_table_01"]
    },
    {
      "number": "8",
      "name": "PH",
      "electrical": "power_out",
      "style": "line",
      "group": "switching",
      "unit": 1,
      "hidden": false,
      "confidence": 0.98,
      "evidence_region_ids": ["r_pinout_01", "r_pin_table_01"]
    },
    {
      "number": "DAP",
      "name": "DAP",
      "electrical": "power_in",
      "style": "line",
      "group": "power",
      "unit": 1,
      "hidden": false,
      "confidence": 0.9,
      "evidence_region_ids": ["r_pinout_01", "r_pin_table_01"]
    }
  ],
  "properties": {
    "datasheet": "https://www.ti.com/lit/ds/symlink/tps5430.pdf",
    "description": "3-A wide-input-range step-down converter",
    "footprint": "",
    "keywords": "buck regulator step-down converter PowerPAD"
  },
  "provenance": {
    "evidence_datasheet_id": "ds_sha256_83074fc1265c8e5c6639511b",
    "evidence_content_sha256": "83074fc1265c8e5c6639511bdb9f83e96c6e6f993613deadea0d09c3a12a2c07",
    "extractor_version": "tokito-dsvire.reviewed-crop-transcription@0.1.0",
    "model": "openai-codex-agent-vision",
    "extracted_at": "2026-08-08T10:55:44Z"
  }
}
